<?xml version="1.0" encoding="UTF-8"?>
<tns:inputSchema
	xmlns:tns="http://www.ccw.io/toccer-backend/inputSchema"
	xmlns:xsi="http://www.w3.org/2001/XMLSchema-instance"
	xsi:schemaLocation="http://www.ccw.io/toccer-backend/inputSchema ../inputSchema.xsd ">
	<tns:xpath>
		<tns:expressionWithReplaces>//html:ul[@id="expandVolume-65"]//html:a[{0}]/@href</tns:expressionWithReplaces>
		<tns:strategy xsi:type="tns:countStrategy">
			<tns:xpath>count(//html:ul[@id="expandVolume-65"]//html:a)</tns:xpath>
		</tns:strategy>
		<tns:next>
			<tns:strategy xsi:type="tns:multiDataOnOnePageCountStrategy">
				<tns:maxXpath>count(//html:div[contains(@class, 'searchResultContent')])</tns:maxXpath>
				<tns:categoryForEachEntry>true</tns:categoryForEachEntry>
				<tns:titleForEachEntry>false</tns:titleForEachEntry>
			</tns:strategy>
		</tns:next>
	</tns:xpath>

	<tns:titleXpath>//html:div[contains(@class, 'searchResultContent')]//html:h4[contains(@class, 'titleSearchPageResult')]</tns:titleXpath>
	<tns:authorXpath>normalize-space((//html:div[contains(@class, 'searchResultContent')])[{0}]//html:div[contains(@class, 'contributors')])</tns:authorXpath>
	<tns:pageXpath>substring-before(substring-after((//html:div[contains(@class, 'searchResultContent')])[{0}]//html:span[contains(@class, 'pageRange')], 'Page range: '), '-')</tns:pageXpath>
	<tns:volumeXpath>substring-before(substring-after(//html:h1, 'Issue '), ' - ')</tns:volumeXpath>
	<tns:categoryXpath>normalize-space((//html:div[contains(@class, 'searchResultContent')])[{0}]/../../../../html:h3)</tns:categoryXpath>

	<tns:startingHtmlPage>https://www.degruyter.com/view/j/itit</tns:startingHtmlPage>
	<tns:baseUrl>https://www.degruyter.com</tns:baseUrl>
	<tns:labelNameOfPublication>it â€“ Information Technology, Volume 65</tns:labelNameOfPublication>
	<tns:labelToc>Table of Contents</tns:labelToc>
	<tns:labelIssuePage>Issue, Page</tns:labelIssuePage>
	<tns:sortCategories>false</tns:sortCategories>
	<tns:emptyCategoryReplacements>
		<tns:fallbackCategoryName>FRONTMATTER</tns:fallbackCategoryName>
	</tns:emptyCategoryReplacements>
</tns:inputSchema>
