<?xml version="1.0" encoding="UTF-8"?>
<tns:inputSchema xmlns:tns="http://www.example.org/inputSchema"
	xmlns:xsi="http://www.w3.org/2001/XMLSchema-instance"
	xsi:schemaLocation="http://www.example.org/inputSchema inputSchema.xsd ">
	<tns:xpath>
		<tns:fixedPostUrlStrategy>
			<tns:json>true</tns:json>
			<tns:post>true</tns:post>
			<tns:fixedUrls>
				<tns:headers>Host: ieeexplore.ieee.org</tns:headers>
				<tns:headers>Origin: https://ieeexplore.ieee.org</tns:headers>
				<tns:content>{"isnumber": "8239922", "punumber": "52", "sortType": "vol-only-seq", "rowsPerPage": "50"}</tns:content>
				<tns:url>https://ieeexplore.ieee.org/rest/search/pub/52/issue/8239922/toc</tns:url>
			</tns:fixedUrls>
			<tns:fixedUrls>
				<tns:headers>Host: ieeexplore.ieee.org</tns:headers>
				<tns:headers>Origin: https://ieeexplore.ieee.org</tns:headers>
				<tns:content>{"isnumber": "8314148", "punumber": "52", "sortType": "vol-only-seq", "rowsPerPage": "50"}</tns:content>
				<tns:url>https://ieeexplore.ieee.org/rest/search/pub/52/issue/8314148/toc</tns:url>
			</tns:fixedUrls>
			<tns:fixedUrls>
				<tns:headers>Host: ieeexplore.ieee.org</tns:headers>
				<tns:headers>Origin: https://ieeexplore.ieee.org</tns:headers>
				<tns:content>{"isnumber": "8354413", "punumber": "52", "sortType": "vol-only-seq", "rowsPerPage": "50"}</tns:content>
				<tns:url>https://ieeexplore.ieee.org/rest/search/pub/52/issue/8354413/toc</tns:url>
			</tns:fixedUrls>
			<tns:fixedUrls>
				<tns:headers>Host: ieeexplore.ieee.org</tns:headers>
				<tns:headers>Origin: https://ieeexplore.ieee.org</tns:headers>
				<tns:content>{"isnumber": "8405616", "punumber": "52", "sortType": "vol-only-seq", "rowsPerPage": "50"}</tns:content>
				<tns:url>https://ieeexplore.ieee.org/rest/search/pub/52/issue/8405616/toc</tns:url>
			</tns:fixedUrls>
			<tns:fixedUrls>
				<tns:headers>Host: ieeexplore.ieee.org</tns:headers>
				<tns:headers>Origin: https://ieeexplore.ieee.org</tns:headers>
				<tns:content>{"isnumber": "8474478", "punumber": "52", "sortType": "vol-only-seq", "rowsPerPage": "50"}</tns:content>
				<tns:url>https://ieeexplore.ieee.org/rest/search/pub/52/issue/8474478/toc</tns:url>
			</tns:fixedUrls>
			<tns:fixedUrls>
				<tns:headers>Host: ieeexplore.ieee.org</tns:headers>
				<tns:headers>Origin: https://ieeexplore.ieee.org</tns:headers>
				<tns:content>{"isnumber": "8552618", "punumber": "52", "sortType": "vol-only-seq", "rowsPerPage": "50"}</tns:content>
				<tns:url>https://ieeexplore.ieee.org/rest/search/pub/52/issue/8552618/toc</tns:url>
			</tns:fixedUrls>
		</tns:fixedPostUrlStrategy>
		<tns:next>
			<tns:multiDataOnOnePageCountStrategy>
				<tns:maxXpath>count(//html:div[@class="records"]/html:div[@class="json_object"])</tns:maxXpath>
				<tns:categoryForEachEntry>true</tns:categoryForEachEntry>
			</tns:multiDataOnOnePageCountStrategy>
		</tns:next>
	</tns:xpath>

	<tns:titleXpath>normalize-space(//html:div[@class="records"]/html:div[@class="json_object"][{0}]/html:div[@class="articleTitle"]/text())</tns:titleXpath>
	<tns:authorXpath>string-join(//html:div[@class="records"]/html:div[@class="json_object"][{0}]/html:div[@class="authors"]//html:div[@class="preferredName"]/text(), ', ')</tns:authorXpath>
	<tns:pageXpath>normalize-space(//html:div[@class="records"]/html:div[@class="json_object"][{0}]/html:div[@class="startPage"]/text())</tns:pageXpath>
	
	<tns:volumeXpath>normalize-space(//html:div[@class="records"]/html:div[@class="json_object"][{0}]/html:div[@class="issue"]/text())</tns:volumeXpath>
	<tns:categoryXpath>normalize-space(//idonotexist/text())</tns:categoryXpath>
	<tns:baseUrl>https://ieeexplore.ieee.org</tns:baseUrl>
	<tns:sortCategories>false</tns:sortCategories>
	
	<tns:emptyCategoryReplacements>
		<tns:fallbackCategoryName>ERROR</tns:fallbackCategoryName>
		<tns:manualCategoryReplacement>
			<tns:categoryName>SAFETY AND SECURITY IN CYBER-PHYSICAL SYSTEMS</tns:categoryName>
			<tns:ifVolumeIs>1</tns:ifVolumeIs>
		</tns:manualCategoryReplacement>
		<tns:manualCategoryReplacement>
			<tns:categoryName>RELEASE ENGINEERING 3.0</tns:categoryName>
			<tns:ifVolumeIs>2</tns:ifVolumeIs>
		</tns:manualCategoryReplacement>
		<tns:manualCategoryReplacement>
			<tns:categoryName>MICROSERVICES</tns:categoryName>
			<tns:ifVolumeIs>3</tns:ifVolumeIs>
		</tns:manualCategoryReplacement>
		<tns:manualCategoryReplacement>
			<tns:categoryName>PROCESS IMPROVEMENT</tns:categoryName>
			<tns:ifVolumeIs>4</tns:ifVolumeIs>
		</tns:manualCategoryReplacement>
		<tns:manualCategoryReplacement>
			<tns:categoryName>SOFTWARE ENGINEERING'S 50TH ANNIVERSARY</tns:categoryName>
			<tns:ifVolumeIs>5</tns:ifVolumeIs>
		</tns:manualCategoryReplacement>
		<tns:manualCategoryReplacement>
			<tns:categoryName>COLLABORATIVE MODELING IN SOFTWARE ENGINEERING</tns:categoryName>
			<tns:ifVolumeIs>6</tns:ifVolumeIs>
		</tns:manualCategoryReplacement>
	</tns:emptyCategoryReplacements>
</tns:inputSchema>
