<?xml version="1.0" encoding="UTF-8"?>
<tns:inputSchema
	xmlns:tns="http://www.ccw.io/toccer-backend/inputSchema"
	xmlns:xsi="http://www.w3.org/2001/XMLSchema-instance"
	xsi:schemaLocation="http://www.ccw.io/toccer-backend/inputSchema ../inputSchema.xsd ">
	<tns:xpath>
		<tns:expressionWithReplaces>//html:li[html:h2[html:span[contains(text(), 'Volume 23')]]]/html:ul/html:li[{0}]/html:a/@href</tns:expressionWithReplaces>
		<tns:strategy xsi:type="tns:countStrategy">
			<tns:xpath>count(//html:li[html:h2[html:span[contains(text(), 'Volume 23')]]]/html:ul/html:li)</tns:xpath>
		</tns:strategy>
		<tns:next>
			<tns:expressionWithReplaces>substring-after(//html:li[html:article[contains(@class, 'app-card-open')]][{0}]//html:a/@href, 'https://link.springer.com')</tns:expressionWithReplaces>
			<tns:strategy xsi:type="tns:countStrategy">
				<tns:xpath>count(//html:article[contains(@class, 'app-card-open')])</tns:xpath>
			</tns:strategy>
			<tns:cachedXpathResult>
				<tns:name>issueNumber</tns:name>
				<tns:xpath>substring-after(substring-after(//html:meta[contains(@property, 'og:title')]/@content, ', '), ' ')</tns:xpath>
			</tns:cachedXpathResult>
		</tns:next>
	</tns:xpath>

	<tns:titleXpath>//html:meta[@name="citation_title"]/@content</tns:titleXpath>
	<tns:authorXpath>string-join(//html:meta[@name="dc.creator"]/@content, '; ')</tns:authorXpath>
	<tns:pageXpath>//html:meta[@name="citation_firstpage"]/@content</tns:pageXpath>
	<tns:volumeXpath onlyHandleAsReplacement="true">{issueNumber}</tns:volumeXpath>
	<tns:categoryXpath>//html:meta[@name="citation_article_type"]/@content</tns:categoryXpath>

	<tns:startingHtmlPage>https://link.springer.com/journal/volumesAndIssues/13222</tns:startingHtmlPage>
	<tns:baseUrl>https://link.springer.com</tns:baseUrl>
	<tns:labelNameOfPublication>Datenbank-Spektrum, Band 23</tns:labelNameOfPublication>
	<tns:labelToc>Inhaltsverzeichnis</tns:labelToc>
	<tns:labelIssuePage>Ausgabe, Seite</tns:labelIssuePage>
	<tns:sortCategories>false</tns:sortCategories>
</tns:inputSchema>
