<?xml version="1.0" encoding="UTF-8"?>
<tns:inputSchema
	xmlns:tns="http://www.ccw.io/toccer-backend/inputSchema"
	xmlns:xsi="http://www.w3.org/2001/XMLSchema-instance"
	xsi:schemaLocation="http://www.ccw.io/toccer-backend/inputSchema ../inputSchema.xsd ">
	<tns:xpath>
		<tns:strategy xsi:type="tns:fixedPostUrlStrategy">
			<tns:json>true</tns:json>
			<tns:post>true</tns:post>
			<tns:fixedUrls>
				<tns:headers>Host: ieeexplore.ieee.org</tns:headers>
				<tns:headers>Origin: https://ieeexplore.ieee.org</tns:headers>
				<tns:content>{"isnumber": "8960916", "punumber": "2", "sortType": "vol-only-seq", "rowsPerPage": "50"}</tns:content>
				<tns:url>https://ieeexplore.ieee.org/rest/search/pub/2/issue/8960916/toc</tns:url>
			</tns:fixedUrls>
			<tns:fixedUrls>
				<tns:headers>Host: ieeexplore.ieee.org</tns:headers>
				<tns:headers>Origin: https://ieeexplore.ieee.org</tns:headers>
				<tns:content>{"isnumber": "8996090", "punumber": "2", "sortType": "vol-only-seq", "rowsPerPage": "50"}</tns:content>
				<tns:url>https://ieeexplore.ieee.org/rest/search/pub/2/issue/8996090/toc</tns:url>
			</tns:fixedUrls>
			<tns:fixedUrls>
				<tns:headers>Host: ieeexplore.ieee.org</tns:headers>
				<tns:headers>Origin: https://ieeexplore.ieee.org</tns:headers>
				<tns:content>{"isnumber": "9034209", "punumber": "2", "sortType": "vol-only-seq", "rowsPerPage": "50"}</tns:content>
				<tns:url>https://ieeexplore.ieee.org/rest/search/pub/2/issue/9034209/toc</tns:url>
			</tns:fixedUrls>
			<tns:fixedUrls>
				<tns:headers>Host: ieeexplore.ieee.org</tns:headers>
				<tns:headers>Origin: https://ieeexplore.ieee.org</tns:headers>
				<tns:content>{"isnumber": "9062349", "punumber": "2", "sortType": "vol-only-seq", "rowsPerPage": "50"}</tns:content>
				<tns:url>https://ieeexplore.ieee.org/rest/search/pub/2/issue/9062349/toc</tns:url>
			</tns:fixedUrls>
			<tns:fixedUrls>
				<tns:headers>Host: ieeexplore.ieee.org</tns:headers>
				<tns:headers>Origin: https://ieeexplore.ieee.org</tns:headers>
				<tns:content>{"isnumber": "9089073", "punumber": "2", "sortType": "vol-only-seq", "rowsPerPage": "50"}</tns:content>
				<tns:url>https://ieeexplore.ieee.org/rest/search/pub/2/issue/9089073/toc</tns:url>
			</tns:fixedUrls>
			<tns:fixedUrls>
				<tns:headers>Host: ieeexplore.ieee.org</tns:headers>
				<tns:headers>Origin: https://ieeexplore.ieee.org</tns:headers>
				<tns:content>{"isnumber": "9107270", "punumber": "2", "sortType": "vol-only-seq", "rowsPerPage": "50"}</tns:content>
				<tns:url>https://ieeexplore.ieee.org/rest/search/pub/2/issue/9107270/toc</tns:url>
			</tns:fixedUrls>
			<tns:fixedUrls>
				<tns:headers>Host: ieeexplore.ieee.org</tns:headers>
				<tns:headers>Origin: https://ieeexplore.ieee.org</tns:headers>
				<tns:content>{"isnumber": "9130391", "punumber": "2", "sortType": "vol-only-seq", "rowsPerPage": "50"}</tns:content>
				<tns:url>https://ieeexplore.ieee.org/rest/search/pub/2/issue/9130391/toc</tns:url>
			</tns:fixedUrls>
			<tns:fixedUrls>
				<tns:headers>Host: ieeexplore.ieee.org</tns:headers>
				<tns:headers>Origin: https://ieeexplore.ieee.org</tns:headers>
				<tns:content>{"isnumber": "9153282", "punumber": "2", "sortType": "vol-only-seq", "rowsPerPage": "50"}</tns:content>
				<tns:url>https://ieeexplore.ieee.org/rest/search/pub/2/issue/9153282/toc</tns:url>
			</tns:fixedUrls>
			<tns:fixedUrls>
				<tns:headers>Host: ieeexplore.ieee.org</tns:headers>
				<tns:headers>Origin: https://ieeexplore.ieee.org</tns:headers>
				<tns:content>{"isnumber": "9187448", "punumber": "2", "sortType": "vol-only-seq", "rowsPerPage": "50"}</tns:content>
				<tns:url>https://ieeexplore.ieee.org/rest/search/pub/2/issue/9187448/toc</tns:url>
			</tns:fixedUrls>
			<tns:fixedUrls>
				<tns:headers>Host: ieeexplore.ieee.org</tns:headers>
				<tns:headers>Origin: https://ieeexplore.ieee.org</tns:headers>
				<tns:content>{"isnumber": "9206399", "punumber": "2", "sortType": "vol-only-seq", "rowsPerPage": "50"}</tns:content>
				<tns:url>https://ieeexplore.ieee.org/rest/search/pub/2/issue/9206399/toc</tns:url>
			</tns:fixedUrls>
			<tns:fixedUrls>
				<tns:headers>Host: ieeexplore.ieee.org</tns:headers>
				<tns:headers>Origin: https://ieeexplore.ieee.org</tns:headers>
				<tns:content>{"isnumber": "9237328", "punumber": "2", "sortType": "vol-only-seq", "rowsPerPage": "50"}</tns:content>
				<tns:url>https://ieeexplore.ieee.org/rest/search/pub/2/issue/9237328/toc</tns:url>
			</tns:fixedUrls>
			<tns:fixedUrls>
				<tns:headers>Host: ieeexplore.ieee.org</tns:headers>
				<tns:headers>Origin: https://ieeexplore.ieee.org</tns:headers>
				<tns:content>{"isnumber": "9269873", "punumber": "2", "sortType": "vol-only-seq", "rowsPerPage": "50"}</tns:content>
				<tns:url>https://ieeexplore.ieee.org/rest/search/pub/2/issue/9269873/toc</tns:url>
			</tns:fixedUrls>
		</tns:strategy>
		<tns:next>
			<tns:strategy xsi:type="tns:multiDataOnOnePageCountStrategy">
				<tns:maxXpath>count(//html:div[@class="records"]/html:div[@class="json_object"])</tns:maxXpath>
				<tns:categoryForEachEntry>true</tns:categoryForEachEntry>
			</tns:strategy>
		</tns:next>
	</tns:xpath>

	<tns:titleXpath>normalize-space(//html:div[@class="records"]/html:div[@class="json_object"][{0}]/html:div[@class="articleTitle"]/text())</tns:titleXpath>
	<tns:authorXpath>string-join(//html:div[@class="records"]/html:div[@class="json_object"][{0}]/html:div[@class="authors"]//html:div[@class="preferredName"]/text(), ', ')</tns:authorXpath>
	<tns:pageXpath>normalize-space(//html:div[@class="records"]/html:div[@class="json_object"][{0}]/html:div[@class="startPage"]/text())</tns:pageXpath>
	
	<tns:volumeXpath>normalize-space(//html:div[@class="records"]/html:div[@class="json_object"][{0}]/html:div[@class="issue"]/text())</tns:volumeXpath>
	<tns:categoryXpath>normalize-space(//html:div[@class="records"]/html:div[@class="json_object"][{0}]/html:div[@class="subjectCategories"]/text())</tns:categoryXpath>
	<tns:baseUrl>https://ieeexplore.ieee.org</tns:baseUrl>
	<tns:labelNameOfPublication>IEEE Computer, Volume 53</tns:labelNameOfPublication>
	<tns:labelToc>Table of Contents</tns:labelToc>
	<tns:labelIssuePage>Issue, Page</tns:labelIssuePage>
	<tns:sortCategories>true</tns:sortCategories>
</tns:inputSchema>
